Metric,Baseline,Finetuned
"Clinical data analytics, Epic System expertise, healthcare quality reporting",1,0.72690463,1,0.63455033,"experience in a Data analytics role Clinical experience (PT, informatics, healthcare, quality, [...]",skills.Excellent communication and organizational skills. The Data Analyst is responsible for [...],skills to ensure data analytics objectives and requirements are met. IT Data Analyst works [...],"experience in a Data analytics role Clinical experience (PT, informatics, healthcare, quality, [...]",skills and healthcare industry knowledge to provide insights that support decision-making and [...],"experience.Collaborate with other solution and functional teams (e.g., commercial operations, [...]"
"Online retail analytics, SQL query writing, advanced data visualization",0,,1,0.5145144,"Skills RequiredTechnical Requirements: • Strong written, oral, and interpersonal [...]","experience for hundreds of thousands of end customers around the world “Provide the insight, [...]",Skills:2 intermediate analytics skills (BQ/SQL),experience projects in Nordstrom’s high-growth Direct online channel. This individual should [...],requirements. · Strong SQL skills and proficiency in data visualization tools are essential [...],requirements.Supports a database optimization project supporting trade dress cut-over [...]
"Advanced A/B testing, metrics design, insurance industry analytics",0,,1,0.68312407,"experience for hundreds of thousands of end customers around the world “Provide the insight, [...]",requirements for data integration and business intelligence applications. Review project [...],experience.You will collaborate with other team leads and stakeholders to understand and [...],Skills: Your Expertise: 5+ years in industry experience and a degree (Masters or PhD is a [...],"Qualifications - Bachelor degree in Mathematics, Statistics, Computer Science, or Analytics - [...]","experience for hundreds of thousands of end customers around the world “Provide the insight, [...]"
"Data cleansing techniques, Power Query (M Language, DAX), ERP systems (JDE)",0,,1,0.67971647,skills: 2-5 y of exp with data analysis/ data integrity/ data governance; PowerBI development; [...],"Experience with various databases including SQL Server, Teradata, Snowflake, and Synapse.Solid [...]",Requirements Documents (BRDs) and technical design Documents (TRDs).Use appropriate tools to [...],"requirements and objectives. Collect, cleanse, and validate data from various sources to [...]",experience in the U.S. Financial Industry as a business or data analystStrong knowledge of [...],QUALIFICATIONS Required Certifications DoD IAT Level III Certification (Must obtain within 180 [...]
"Data integration, SQL optimization, Hadoop experience",0,,1,0.6300535,Experience supporting and troubleshooting complex data systems and integrations* Experience [...],"SkillsExpertise and hands-on experience on Spark, and Hadoop echo system components – Must [...]","Experience with various databases including SQL Server, Teradata, Snowflake, and Synapse.Solid [...]",experience in querying the high volumes of data and doing the data analysis must inform how [...],Experience supporting and troubleshooting complex data systems and integrations* Experience [...],"Role - Azure Data Engineer + Hadoop and SQL Exp.Location - Bellevue, WA (Day 1 Onsite) Job [...]"
"Healthcare claims data analysis, complex SQL optimization, ETL process support",1,0.59021187,1,0.620225,skills.Excellent communication and organizational skills. The Data Analyst is responsible for [...],"experience in using, manipulating, and extracting insights from healthcare data with a [...]","experience in a Data analytics role Clinical experience (PT, informatics, healthcare, quality, [...]",skills.Excellent communication and organizational skills. The Data Analyst is responsible for [...],"experience in using, manipulating, and extracting insights from healthcare data with a [...]","requirements, plan and execute projects, and produce actionable data to support strategic [...]"
"GCP BigQuery, Data Pipeline Development, Technical Documentation Skills",0,,1,0.60083425,"Qualifications:SKILLS NEEEDED: Teradata, GCP BigQuery, Python Data Processing- Scripting, [...]",experience with agile engineering and problem-solving creativity. United by our core values [...],"Skills: Big Data, GCP, Apache Spark, Apache Beam Requirements:Bachelor's degree in Computer [...]",requirements Skills Required: Have Technical Documentation Skill by translating business [...],"Skills: GCP Data Engineer with 3-4 years of hands-on GCP/BigQuery experience (GCP, BigQuery, [...]","requirements for our direct client, please go through the below Job Description. If you are [...]"
"Palantir Foundry, Data Engineering features, Ontology Manager",1,0.59659314,1,0.7473177,experience on Palantir Foundry8+ years in Data Engineering and must have at least 3-4 years of [...],skills and attention to detail. Job Duties: · Participation in user interviews to understand [...],"requirements to pull required data to measure the current state of these assets, set up usage [...]",experience on Palantir Foundry8+ years in Data Engineering and must have at least 3-4 years of [...],skills and attention to detail. Job Duties: · Participation in user interviews to understand [...],"skills in the broader Capital One team Promote a culture of engineering excellence, using [...]"
"Senior Healthcare Data Analyst, SAS, SQL, Healthcare Analytics",0,,2,0.5433456,skills to ensure data analytics objectives and requirements are met. IT Data Analyst works [...],"experience in a Data analytics role Clinical experience (PT, informatics, healthcare, quality, [...]","experience in using, manipulating, and extracting insights from healthcare data with a [...]",experience in SQL required. Experience in the health care preferred. Experience in python/R [...],Qualifications: Bachelor's degree or equivalent combination of education and experience [...],skills in the creation and interpretation of quantitative analyses and predictive models and [...]
"AI compiler development, advanced compilation techniques, AI strategy leadership",6,0.39800426,1,0.47863066,"experience with high-performance computing, it would be advantageous, especially in optimizing [...]",Requirements Description and Requirements Role Value Proposition: The Platforms & Engineering [...],"experienced, passionate pioneer in technology - a solutions builder, a roll-up-your-sleeves [...]","QualificationsAdvanced degree (Ph.D. preferred) in Computer Science, Electrical Engineering, [...]","Requirements:Proven experience as an AI Engineer, with a strong track record of developing and [...]",Requirements Description and Requirements Role Value Proposition: The Platforms & Engineering [...]
"Project management, process improvement, budget coordination",2,0.5235386,1,0.702837,requirements and offer effective solutions. The Senior Procurement Data Analyst provides key [...],Actively participates in projects in assigned area of responsibility; develops and manages [...],"requirements of analyses and reports.Transform requirements into actionable, high-quality [...]",Actively participates in projects in assigned area of responsibility; develops and manages [...],"requirements, processes, and workflows. They will work closely with project managers, [...]","Skills/Attributes Data analysis, verbal communication mastery, written communication mastery, [...]"
Data Engineer SQL AWS Redshift BI Tools,0,,1,0.569103,requirements Source to target mapping SQL Skills- running queries AWS and Databricks [...],"Requirements/Must Have Skills:Experience working in AWS environment (S3, Snowflake, EC2, [...]","experienced Data Engineer to maintain and enhance current data environment while providing, [...]","experience, this is your chance to make history. The team continues to innovate with delivery [...]",experience. Strong SQL Skills Strong Python Skills What are the top three PREFERRED skill sets [...],Skills :• Configure AEP to get the data set needed and then use spark (AWS glue ) to load data [...]
"Data Scientist with expertise in statistical analysis, machine learning infrastructure, and business alignment strategies.",0,,1,0.46231905,"experience, operating performance improvement, and increased safety best practices. Develop [...]",experience to build machine-learning models. You will collaborate closely with our Field [...],"requirements, objectives, and challenges. Translate business needs into actionable insights [...]",experiences and business solutions capable of powering the most high-scale websites in the [...],"skills to drive real world impact. You will lead end-to-end machine learning projects, driving [...]",experience to build machine-learning models. You will collaborate closely with our Field [...]
"Loans data analysis, KNIME data pipeline development, SharePoint site management",0,,1,0.60288835,"requirements to pull required data to measure the current state of these assets, set up usage [...]","skills, able to translate complex business requirements into sound data management and data [...]","experience with Databricks, PySpark, SQL, Spark clusters, and Jupyter Notebooks.- Expertise in [...]","Skills/Attributes: Data Analysis, Loan Processing, Microsoft Office, SQL Job Description [...]","Qualifications:Extensive experience in finance or project management, proficiency in tools [...]",Qualifications:• 10+ years of experience • Experience and proficiency building data pipelines [...]
"customer lifecycle analysis, monetization analytics, multivariate experimentation",10,0.4507121,1,0.47200143,"experience for hundreds of thousands of end customers around the world “Provide the insight, [...]",experience as increase conversion rates. Work with marketing analysts and marketing operations [...],experience. You are comfortable with a range of statistical and ML techniques with the ability [...],experiences based on user attributes Identify key trends and build automated reporting & [...],experience. You are comfortable with a range of statistical and ML techniques with the ability [...],experience to build machine-learning models. You will collaborate closely with our Field [...]
"IT Data Engineer, data pipeline optimization, ETL development, cloud-based infrastructure",0,,1,0.54971266,experience in ETL/DW Strong experience in setting up enterprise data platforms with modern [...],"experienced Data Engineer to maintain and enhance current data environment while providing, [...]",QualificationsData Engineering and Data Modeling skillsExperience with ETL (Extract Transform [...],"experience with all aspects of the software development lifecycle, from design to deployment. [...]","requirements into technical solutions, including data model designs and API [...]","Qualifications Data Engineering, Data Modeling, and ETL (Extract Transform Load) skillsData [...]"
predictive modeling health claims data Azure ML,0,,2,0.4691264,skills.Excellent communication and organizational skills. The Data Analyst is responsible for [...],"experience. As an employee, you’re empowered to show up every day as your most authentic self [...]","experience in using, manipulating, and extracting insights from healthcare data with a [...]","requirements, plan and execute projects, and produce actionable data to support strategic [...]",Skills: Strong experience in data science and analytics - 4 years minimumProficiency in [...],"experience in using, manipulating, and extracting insights from healthcare data with a [...]"
"Java development, AWS cloud services, microservices architecture",6,0.4489636,1,0.7277367,experience and should be completely comfortable and up to date with the recent versions of [...],"Skill set Required: Primary:Python, Scala, AWS servicesNoSQL storage databases such Cassandra [...]",experience: Software Development for Infrastructure as Code (IaC) with Python or TypeScript: [...],"skills, emphasizing cross-functional collaboration and comprehensive project planning, [...]",requirements to technology solutions. You will serve as mentor for junior engineers within the [...],"Skill set Required: Primary:Python, Scala, AWS servicesNoSQL storage databases such Cassandra [...]"
"Senior Data Scientist, biological sample analysis, deep learning CNN architecture, predictive analytics platform",1,0.66547394,1,0.63028073,experience with Python who would be able to support algorithm and data model development [...],"experience (3+ years) in developing and deploying machine learning models, particularly in [...]",experienced data scientist who thrives on innovation and craves the vibrancy of a startup [...],experience with Python who would be able to support algorithm and data model development [...],Experience in the biotech industry is advantageous. Requirements: Ø Expertise in deep learning [...],"Experience You’ll Need A PhD in statistics, mathematics, data science, machine learning, [...]"
Generative AI Data Scientist Azure infrastructure Gen-AI architecture,3,0.5249647,1,0.6266006,"experience in DevOps, ML, MLOps, Big Data, Python, integration, and deployment methodologies. [...]","experienced, passionate pioneer in technology - a solutions builder, a roll-up-your-sleeves [...]","Skills:· Proven experience as a Data Scientist / Cloud Engineer or similar role, with a focus [...]","Skills:· Proven experience as a Data Scientist / Cloud Engineer or similar role, with a focus [...]","experience in DevOps, ML, MLOps, Big Data, Python, integration, and deployment methodologies. [...]",Requirements Description and Requirements Role Value Proposition: The Platforms & Engineering [...]
"cybersecurity risk metrics, data visualization with PowerBI or Tableau, FAIR methodology",0,,2,0.56725204,"requirements, and assist in data structure implementation planning for innovative data [...]",experienced Technical Data Analyst as part of a team that is supporting the law enforcement [...],experience on data analysis/ data integrity/ data governance;Need experience in analytical [...],experience of data analysis or equivalent experience (university included)Bachelor’s degree in [...],experience of data analysis or equivalent experience (university included)Bachelor’s degree in [...],Qualifications: Bachelor's degree in Science with 9 years of experience or Master's Degree and [...]
"signal processing, electromagnetics, computer vision internships summer 2024",0,,1,0.68104184,requirements and develop solutions that meet both technical and business objectives.Design and [...],requirements and develop solutions that meet those needs.Stay up-to-date with emerging trends [...],"skills, and become a part of our global community of talented, diverse, and knowledgeable [...]",skillsMust be U.S. citizen Preferred Requirements Coursework and/or experience with one or [...],"QualificationsRequirementsPh.D. in Computer Vision, Neuroscience, Computer Science, physics, [...]",requirements and develop solutions that meet those needs.Stay up-to-date with emerging trends [...]
Senior Data Engineer Snowflake ETL AWS,3,0.6148931,10,0.46760058,experience with Snowflake.Sound understanding of Python programming.Strong experience with [...],"Skills: AWS, Spark, Adobe Analytics/AEP(Adobe Experience Platform) platform experience, Glue, [...]",experience as a data engineer or in a similar role using Snowflake rigorouslyAdvanced working [...],experience with Snowflake.Sound understanding of Python programming.Strong experience with [...],"requirements gathering, feedback on proposed designs and models, and acceptance testing [...]","experience in bash and cloud concepts such as (EC2, EMR, Glue, ECS, Lambda, IAM, Security [...]"
"AI/ML model development, Python programming, onsite collaboration",1,0.6394502,1,0.69986415,experience in Python Experience in creating AI/ML models from scratch,Skills – Python– 6+ Yrs of Exp – Pyspark –6+ Yrs of Exp – Pytorch–6+ Yrs of Exp – GCP –3 + Yrs [...],experience with the Refactor the Macro code from local Python/R implementation to Databricks [...],experience in Python Experience in creating AI/ML models from scratch,experience is built in a number of ways. Even if your background doesn’t match the exact [...],"Experience You'll Bring Master's degree in Computer Science, Statistics, Mathematics, or a [...]"
"healthcare informatics, clinical decision support, data visualization for patient monitoring",0,,1,0.6733242,"experience in a Data analytics role Clinical experience (PT, informatics, healthcare, quality, [...]",skills to ensure data analytics objectives and requirements are met. IT Data Analyst works [...],"experience in using, manipulating, and extracting insights from healthcare data with a [...]","experienceCollaborate with other solution and functional teams (e.g., commercial operations, [...]","experience.Collaborate with other solution and functional teams (e.g., commercial operations, [...]","skills in data science to analyze and interpret complex data sets, provide insights and [...]"
"Advanced data modeling techniques, Natural Language Processing (NLP), reinforcement learning",0,,9,0.2725816,"Experience in Machine Learning and Deep Learning, including regression, classification, neural [...]","experience in Natural Language Processing (NLP). In this role, you will play a crucial role in [...]","requirements from business stakeholders, identifying opportunities to apply advanced analytic [...]","experiences that you bring. As you read through the expectations of the position, consider how [...]",Requirements:Bachelors degree or equivalent practical experience.5+ years of experience with [...],"RequirementsMaster’s degree or PhD in computer science, artificial intelligence, applied [...]"
"Machine Learning Engineer, ML forecasting, ARIMA, DSI Metrics Farm",1,0.69358164,1,0.5808711,"skills will be difficult. The more aligned skills they have, the better.Organizational [...]",experienced and passionate full-stack data scientist in our Data organization. This role will [...],"experience and financial performance of hospitals, health systems and medical groups. We are [...]","skills will be difficult. The more aligned skills they have, the better.Organizational [...]","experience in forecasting, particularly in demand or sales forecasting. The ideal candidate [...]","experienced ML engineers and scientists, and define team best practices and processesLead in [...]"
"distributed systems architecture, high-performance computing, AI-powered developer tools",1,0.66947293,1,0.7028048,"experience with high-performance computing, it would be advantageous, especially in optimizing [...]",Skills – Python– 6+ Yrs of Exp – Pyspark –6+ Yrs of Exp – Pytorch–6+ Yrs of Exp – GCP –3 + Yrs [...],"requirements.Optimizing the existing GenAI models for performance improvement, scalability, [...]","experience with high-performance computing, it would be advantageous, especially in optimizing [...]","requirements. Can work with large scale computing frameworks, data analysis systems and [...]","Requirements:Proven experience as an AI Engineer, with a strong track record of developing and [...]"
"aviation data analysis, statistical modeling, time-series forecasting",1,0.46664065,1,0.36011964,"requirements from business stakeholders, identifying opportunities to apply advanced analytic [...]","requirements, objectives, and challenges. Translate business needs into actionable insights [...]",experienced Meteorological Data Scientist to join our growing data science team. The ideal [...],"requirements from business stakeholders, identifying opportunities to apply advanced analytic [...]","Qualifications Data Science, Statistics, and Data Analytics skillsData Visualization and Data [...]",experience. Requirements:Proven AI research in finance industry. Ideally published with [...]
"Computer Vision, Behavioral Analysis, Neuroscience Research",0,,1,0.6710855,"skills in data science, statistics, and computer science, particularly as they apply to the [...]","Experience in Machine Learning and Deep Learning, including regression, classification, neural [...]","requirements. Use system reports and analyses to identify potentially problematic data, make [...]","QualificationsRequirementsPh.D. in Computer Vision, Neuroscience, Computer Science, physics, [...]","skills in data science, statistics, and computer science, particularly as they apply to the [...]",experienced enough to ask for help for efficiency.• Ability to understand intent without [...]
"Legal data analysis, data aggregation and reporting, Power BI expertise",0,,0,,experienced Technical Data Analyst as part of a team that is supporting the law enforcement [...],experience on data analysis/ data integrity/ data governance;Need experience in analytical [...],"experience to our users, and in doing so we are partnering with the Global Business Solutions [...]",experience on data analysis/ data integrity/ data governance;Need experience in analytical [...],"Requirements Proficiency in PC-based Windows software, including Power BI and Microsoft Office [...]",Experience in crunching data? Love working with data and providing business insights? Power BI [...]
BI DW Engineer Silver Zone tables ERP BigQuery Databricks integration,1,0.7001468,1,0.82714784,BI/DW Engineer/Analyst to help the ERP team model their Silver Zone tables and integrate their [...],Experience: 10+ yrsLocation: RemoteAzure Lead Data Engineers 10 years of experience with [...],"experience in Azure Databricks to join our team. As a Senior Data Scientist at Techions, you [...]",BI/DW Engineer/Analyst to help the ERP team model their Silver Zone tables and integrate their [...],"experienced and passionate professional to join our talented team as a Senior Data Engineer, [...]",experience1. Experience in working with big data in a cloud environment (Azure-Databricks) 2. [...]
"NLP for life sciences, statistical modeling, biomedical informatics",1,0.6011903,1,0.6379265,skills for this position are:Natural Language Processing (NLP)Python (Programming [...],"experience (3+ years) in developing and deploying machine learning models, particularly in [...]","experience in Natural Language Processing (NLP). In this role, you will play a crucial role in [...]",skills for this position are:Natural Language Processing (NLP)Python (Programming [...],"experience (3+ years) in developing and deploying machine learning models, particularly in [...]",experienced data analysts/scientists. Qualifications Master's Degree and at least 3 years of [...]
"Big Data, Cloudera Data Platform, database migration",1,0.48435432,1,0.50563616,"Skills:o Big Data: Spark, Scala, Pyspark, HDFSo Microsoft Stack: MS-SQL with strong knowledge [...]",experienced data pipeline builder and data wrangler who enjoys optimizing data systems and [...],experience in Technical Leadership in a Big Data Environment Teradata experienceETL Experience [...],"Skills:o Big Data: Spark, Scala, Pyspark, HDFSo Microsoft Stack: MS-SQL with strong knowledge [...]",experience ABOUT THE ROLE:Skills: Bachelor’s degree in computer science or related technical [...],Qualifications Education and Years of Experience: Bachelors in related field required 5+ years [...]
"User Growth Analytics, A/B Testing Methodologies, Causal Inference",0,,1,0.67566186,"experience for hundreds of thousands of end customers around the world “Provide the insight, [...]",experience as increase conversion rates. Work with marketing analysts and marketing operations [...],skills of the future by making high-quality education accessible and affordable to [...],"Qualifications - Bachelor degree in Mathematics, Statistics, Computer Science, or Analytics - [...]","experience for hundreds of thousands of end customers around the world “Provide the insight, [...]","experiences, revenue generation, ad targeting, and other business outcomes.Conduct data [...]"
"Senior Machine Learning Scientist drug discovery, protein ML models, scalable AI solutions",1,0.7011236,1,0.73952496,experience in software engineering with a specialization in ML/AI systems.Proven ability to [...],"experience (3+ years) in developing and deploying machine learning models, particularly in [...]","Requirements: Advanced degree in Computer Science, Machine Learning, or a related [...]",experience in software engineering with a specialization in ML/AI systems.Proven ability to [...],"experience (3+ years) in developing and deploying machine learning models, particularly in [...]","Experience You’ll Need A PhD in statistics, mathematics, data science, machine learning, [...]"
"wildfire mitigation data analysis, database infrastructure management, data visualization dashboard development",0,,0,,"skills, able to translate complex business requirements into sound data management and data [...]","experience with Databricks, PySpark, SQL, Spark clusters, and Jupyter Notebooks.- Expertise in [...]","experience in data engineering, software engineering, data analytics, or machine [...]","experience in ITCollaborate with local business users to understand business processes, gather [...]",experience of data analysis or equivalent experience (university included)Bachelor’s degree in [...],"Qualifications Your Experience M.S. or Ph.D degree in Computer Science, Mathematics, [...]"
