Metric,Baseline,Finetuned
API Data Engineer stored procedures AWS Postgres Pycharm TDD,1,0.6713238,1,0.7085034,experience Stored Procs (AWS Postgres) to API integration which is the critical need for the [...],"Skills: Python, Pyspark, SQL, Datawarehouse, Databricks, Snowflake (Minimal), etcType of Role: [...]","experience with Databricks, PySpark, SQL, Spark clusters, and Jupyter Notebooks.- Expertise in [...]",experience Stored Procs (AWS Postgres) to API integration which is the critical need for the [...],Qualifications THE EXPERIENCE YOU BRING TO THE TEAM Minimum Required Skills 2 years of [...],"requirements, identify opportunities for improvement, and drive innovation.Provide technical [...]"
"Data analysis, statistical modeling, Lean Management",0,,4,0.3319698,"requirements, objectives, and challenges. Translate business needs into actionable insights [...]",skills and ability to extract valuable insights from highly complex data sets to ask the right [...],"experience, operating performance improvement, and increased safety best practices. Develop [...]","Qualifications: Good communication verbal/written, Good organization, Good analysis, Customer [...]",skills to redesign and enhance these procedures.Communication (10%): Liaise with different [...],Experience Data Analyst II Education: Bachelor’s Degree from an accredited college or [...]
"Data Governance, Master Data Management, Data Quality Frameworks",2,0.58265173,1,0.63686144,"Qualifications:Deep expertise in Data Management, Data Governance, and Data Quality [...]","Skills:1. Extensive knowledge of Data Management, Data Governance, Data quality activities, [...]",requirements and metrics. Provide training and support to end-users on data quality best [...],"Skills:1. Extensive knowledge of Data Management, Data Governance, Data quality activities, [...]","Qualifications:Deep expertise in Data Management, Data Governance, and Data Quality [...]","experience and drive business outcomes is at the heart of everything FanDuel does, the [...]"
"Data quality management, IT Asset Management, Public Cloud asset management",1,0.59060234,1,0.5759398,"experience every day. And we’ll do it with the utmost integrity, and in an environment where [...]","Qualifications:Deep expertise in Data Management, Data Governance, and Data Quality [...]",experiences that leverage the latest technologies in open source and the Cloud. Digital [...],"experience every day. And we’ll do it with the utmost integrity, and in an environment where [...]","QUALIFICATIONSMust-Have:Bachelor’s Degree in Computer Science, Information Systems, or related [...]",experience in IT projects supporting governmental agencies. Mandatory Qualifications:Must have [...]
"Senior Data Engineer Snowflake, Cloud data solutions (AWS/GCP/Azure), CI/CD pipeline tools",0,,0,,experience: Software Development for Infrastructure as Code (IaC) with Python or TypeScript: [...],experienced Senior Data Engineer / Developer (see skills below) to join our team. The [...],"experience in bash and cloud concepts such as (EC2, EMR, Glue, ECS, Lambda, IAM, Security [...]",experience: Software Development for Infrastructure as Code (IaC) with Python or TypeScript: [...],"experience in bash and cloud concepts such as (EC2, EMR, Glue, ECS, Lambda, IAM, Security [...]",experience as a data engineer or in a similar role using Snowflake rigorouslyAdvanced working [...]
"Data Governance Analyst, Azure Databricks, ELT Optimization",6,0.5129396,2,0.41681468,"experience in Azure Databricks to join our team. As a Senior Data Scientist at Techions, you [...]",Experience: 10+ yrsLocation: RemoteAzure Lead Data Engineers 10 years of experience with [...],"QualificationsData Engineering, Data Modeling, and ETL (Extract Transform Load) skillsMonitor [...]","Skills/Tech: 5-7 years experience Hands-on experience with Databricks and Azure , including [...]","skills, knowledge and experience. Essential Functions Reasonable accommodations may be made to [...]","experience in Azure Databricks to join our team. As a Senior Data Scientist at Techions, you [...]"
"Senior Data Engineering Manager, SQL ETL, Cloud-based SaaS, Team Leadership",0,,0,,"skills. They are expected to work with stakeholders across C2FO from engineering, product, [...]",experience with agile engineering and problem-solving creativity. United by our core values [...],experience with agile engineering and problem-solving creativity. United by our core values [...],experience – we hope you share our enthusiasm! Qualifications BS/MS with quantitative focus [...],experiences and affordable and transparent financial services products. Coast's mission is to [...],"experience3+ years MS SQL Server experienceExceptional T-SQL skills, specifically with the use [...]"
"Data integrity, PowerBI development, data governance",1,0.6128116,2,0.84417945,skills: 2-5 y of exp with data analysis/ data integrity/ data governance; PowerBI development; [...],experience on data analysis/ data integrity/ data governance;Need experience in analytical [...],"skills and proficiency/expertise in analytical tools including PowerBI development, Python, [...]",experience on data analysis/ data integrity/ data governance;Need experience in analytical [...],skills: 2-5 y of exp with data analysis/ data integrity/ data governance; PowerBI development; [...],skills: 2-5 y of exp with data analysis/ data integrity/ data governance; PowerBI development; [...]
"VP Data Engineering, cloud infrastructure, data governance, data architecture",1,0.6427554,1,0.5198446,experienced and skilled VP of Data Engineering to join their team. The ideal candidate will [...],"experienced Data Engineer to maintain and enhance current data environment while providing, [...]",experience : 5 to 8 We are currently seeking an experienced and motivated Senior Data Engineer [...],experienced and skilled VP of Data Engineering to join their team. The ideal candidate will [...],skills and discover what you excel at—all from Day One. Job Description Be a part of [...],requirements and future client-focused solutions and services. Establish robust data [...]
Sr. Data Analyst business process analysis insights recommendations,7,0.45518428,1,0.5191525,"requirements and translating them into automated solutions, to include workflow technical [...]",experience as increase conversion rates. Work with marketing analysts and marketing operations [...],requirements and offer effective solutions. The Senior Procurement Data Analyst provides key [...],"Requirements: US Citizen, GC Holders or Authorized to Work in the U.S. Sr. Data Analyst will [...]",Qualifications • Excellent decision making abilities and effective problem solving skills. [...],"Job Title: Business AnalystDuration: 3+ Months (Temp. To Perm.)Location: 6 Quakerbridge Plaza, [...]"
"Data Governance, Data Quality Frameworks, Data Lineage Tools",0,,0,,"Qualifications:Deep expertise in Data Management, Data Governance, and Data Quality [...]","Skills:1. Extensive knowledge of Data Management, Data Governance, Data quality activities, [...]",requirements and metrics. Provide training and support to end-users on data quality best [...],"Skills:1. Extensive knowledge of Data Management, Data Governance, Data quality activities, [...]","experience and drive business outcomes is at the heart of everything FanDuel does, the [...]","experience and drive business outcomes is at the heart of everything FanDuel does, the [...]"
"DOMO certification, data collection strategies, people analytics reporting",6,0.46699017,1,0.6466146,experienced Technical Data Analyst as part of a team that is supporting the law enforcement [...],"Skills:1. Extensive knowledge of Data Management, Data Governance, Data quality activities, [...]","experience in a Data analytics role Clinical experience (PT, informatics, healthcare, quality, [...]",Qualifications) Minimum two years of experience with DOMO MajorDOMO Certification Required 3+ [...],"Requirements:B.S. in Data Science, Computer Science, Statistics, or a related field.3+ years [...]",Requirements We are seeking 3+ years of related experience and a bachelor's or advanced degree [...]
"Azure Data Engineer, Hadoop, SQL expertise",0,,1,0.69490707,"QualificationsData Engineering, Data Modeling, and ETL (Extract Transform Load) skillsMonitor [...]","SkillsExpertise and hands-on experience on Spark, and Hadoop echo system components – Must [...]","experience.Required Skills: ADF pipelines, SQL, Kusto, Power BI, Cosmos (Scope Scripts). Power [...]","Role - Azure Data Engineer + Hadoop and SQL Exp.Location - Bellevue, WA (Day 1 Onsite) Job [...]",Qualifications:2-5 YOE in programming with SQL and PythonExperience and/or passion for working [...],requirements and develop solutions that meet those needs.· Design and implement scalable and [...]
"full-stack data scientist, statistical modeling, telematics analysis",0,,8,0.30508035,skills and ability to extract valuable insights from highly complex data sets to ask the right [...],skills to provide strategic insights and solutions to complex business problems. This role is [...],"skills in data science to analyze and interpret complex data sets, provide insights and [...]",skills through exceptional training as well as frequent coaching and mentoring from [...],experience to solve some of the most challenging intelligence issues around data. Job [...],QUALIFICATIONS: Bachelor’s degree in computer science (or STEM or related field) and three (3) [...]
"Clarity PPM, data governance, project performance analytics",0,,3,0.6501184,"Requirements: US Citizen, GC Holders or Authorized to Work in the U.S. Job Description We are [...]",requirements and offer effective solutions. The Senior Procurement Data Analyst provides key [...],skills and the ability to connect and communicate across multiple departments.Adept at report [...],"Requirements: US Citizen, GC Holders or Authorized to Work in the U.S. Job Description We are [...]",skills and the ability to connect and communicate across multiple departments.Adept at report [...],skills and the ability to connect and communicate across multiple departments.• Adept at [...]
"Energy trading platform, timeseries forecasting, algorithmic decision tools",1,0.5018357,1,0.7204821,"Requirements:Python (Pandas, Numpy, SciKit-learn, etc.)Timeseries forecastingBuilding [...]",skills towards solving the climate crisis. Main Responsibilities You will help further develop [...],"RequirementsTo perform this job successfully, an individual must be able to perform each [...]","Requirements:Python (Pandas, Numpy, SciKit-learn, etc.)Timeseries forecastingBuilding [...]",requirements and prioritize projects. Team Leadership And Development Lead a team of data [...],"RequirementsTo perform this job successfully, an individual must be able to perform each [...]"
"Natural Language Processing, predictive analytics, Model Risk Management",4,0.37842578,2,0.43601993,"Experience in Machine Learning and Deep Learning, including regression, classification, neural [...]","experience in Natural Language Processing (NLP). In this role, you will play a crucial role in [...]",experience to build machine-learning models. You will collaborate closely with our Field [...],Skills' Details Passion for Machine Learning and Data Science and their fundamentals Research [...],"experience and make a real impact for our members. We believe in our core values of honesty, [...]",requirements for training and evolving deep learning models and algorithms.Articulate a vision [...]
"Azure Synapse, Azure Data Lake Storage, Python libraries for AI",2,0.48224446,1,0.7990102,"experience in DevOps, ML, MLOps, Big Data, Python, integration, and deployment methodologies. [...]","Machine Learning / AI Engineers / Developers Customer: Method360Location: San Antonio, Texas [...]","Skills:· Proven experience as a Data Scientist / Cloud Engineer or similar role, with a focus [...]","Machine Learning / AI Engineers / Developers Customer: Method360Location: San Antonio, Texas [...]",experienced and results-driven Data Engineering Manager to lead our data engineering team. As [...],"Skills/Domain: Microsoft Azure, Synapse, Spark, Python, Angular, C#, .NET, DevOps, Azure [...]"
"TS/SCI cleared Data Scientist, Open Source Intelligence (OSINT), Knowledge Graphs",5,0.5263196,0,,experience to solve some of the most challenging intelligence issues around data. Job [...],Qualifications & Desired Skillsin a CS-related fieldyears of relevant experience (Healthcare [...],"QualificationsRaw data and PED systems support Requests for Information (RFI), rapid [...]",skills and domain knowledge. This position involves open-source research and analytic [...],Requirements We are seeking 3+ years of related experience and a bachelor's or advanced degree [...],skills across application domains. Qualifications Minimum Qualifications: BS/BA and 5+ years [...]
"Oracle Data Engineering, ETL Process Optimization, SQL Data Modeling",4,0.5442104,3,0.48981047,"experienced Data Engineer to join our team in designing, developing, and optimizing data [...]","Experience with various databases including SQL Server, Teradata, Snowflake, and Synapse.Solid [...]","experience in ETL development, coupled with a profound understanding of data extraction, [...]",QualificationsData Engineering and Data Modeling skillsExperience with ETL (Extract Transform [...],QualificationsData Engineering and Data Modeling skillsExperience with ETL (Extract Transform [...],"skills, analytical abilities, written and verbal communication skills, and the ability to [...]"
"Advanced MS Excel, Data Analytics, Project Management",4,0.55172527,5,0.4443686,"Skills RequiredTechnical Requirements: • Strong written, oral, and interpersonal [...]","Skills MS Excel, MS PowerPoint, Data Analysis Tech Skills: 1. Intermediate Level MS Excel [...]",SkillsIntermediate to Advanced user with Excel (vlookup/pivot tables)Microsoft Office [...],"Qualifications:0-2 years relevant experienceAdvanced knowledge of MS Office Suite, including [...]",SkillsIntermediate to Advanced user with Excel (vlookup/pivot tables)Microsoft Office [...],"Requirements Associate’s degree and three or more years of data analytics, or related; or [...]"
Snowflake DataStage AWS S3 Lambda Data Engineer,0,,1,0.53204846,experience as a data engineer or in a similar role using Snowflake rigorouslyAdvanced working [...],experience: Software Development for Infrastructure as Code (IaC) with Python or TypeScript: [...],SKILLS AND EXPERIENCEA successful Lead Data Engineer within this role will likely have the [...],"skills for this role: SnowflakeDataStageAWSS3 LambdaHadoop (little experience is enough), [...]",experience with Snowflake.Sound understanding of Python programming.Strong experience with [...],"Experience working in AWS environment (S3, Snowflake, EC2, APIs)Skilled in coding languages [...]"
"data quality assessment, predictive modeling, collaboration with engineering teams",0,,6,0.31560808,"Qualifications:Deep expertise in Data Management, Data Governance, and Data Quality [...]","Experience with various databases including SQL Server, Teradata, Snowflake, and Synapse.Solid [...]",experienced Technical Data Analyst as part of a team that is supporting the law enforcement [...],requirements and provide data-driven recommendations.Assist in the development and evaluation [...],"requirements gathering, activities, and design phases. They are tasked with developing robust [...]","Qualifications Data Science, Statistics, and Data Analytics skillsData Visualization and Data [...]"
"Proprietary trading analysis, quantitative trading strategies, post-trade performance assessment",1,0.3011375,1,0.4692252,"Requirements: Bachelor's degree in Computer Science, Computer Engineering, Financial [...]",skills requirements: • Business Data Analysis with Wealth Management experience (10+ years). • [...],Requirements: Minimum 3+ years in a data science function working in an equities trading [...],"Requirements: Bachelor's degree in Computer Science, Computer Engineering, Financial [...]",Requirements: Minimum 3+ years in a data science function working in an equities trading [...],Qualifications: At least 3 years of experience within financial markets. 1+ years of [...]
"Data Lakehouse Technologies, Cybersecurity Dashboards, AWS GovCloud Integration",0,,0,,"experience in data engineering, software engineering, data analytics, or machine [...]","experience the youth sports moments important to our community, we are helping families [...]","Experience of Delta Lake, DWH, Data Integration, Cloud, Design and Data Modelling.• Proficient [...]","experience the youth sports moments important to our community, we are helping families [...]","experience: GS-15: Applied Data Science Develops, administers, controls, coordinates, and [...]",Qualifications and Skills Education: Bachelor's degree in Computer Science or a related field. [...]
"Azure Synapse, Apache Spark, SSIS analysis",2,0.55597544,2,0.6878166,"experience in Azure native services. In this role, you will be instrumental in leveraging [...]","Skills ; Apache Spark, Azure Synapse, Azure Databricks, SQL, SSIS Overall IT experience: 10+ [...]","Skills - Apache Spark, Hadoop, Scala, Azure Synapse, Azure Databricks Secondary Skills - SSIS [...]","Skills - Apache Spark, Hadoop, Scala, Azure Synapse, Azure Databricks Secondary Skills - SSIS [...]","Skills ; Apache Spark, Azure Synapse, Azure Databricks, SQL, SSIS Overall IT experience: 10+ [...]","experience in Azure native services. In this role, you will be instrumental in leveraging [...]"
"Asset Management, Preventive Maintenance, ESG Principles",1,0.44467735,1,0.70148593,requirements (while not losing sight of the higher-priority market needs) and then keep the [...],Skills & Experience Bachelor's/University degree. 10+ years of experience in finance/project [...],"requirements and industry practices for mortgage banking.Build high-performance algorithms, [...]",requirements (while not losing sight of the higher-priority market needs) and then keep the [...],"Skills: SQL, Python, Databricks, Airflow, Azure/AWS/GCP, Data Asset Management, Data [...]","Experience And Skills BS/BA (or equivalent) or higher with preference to business, technology, [...]"
"Senior AI Engineer Azure Data Solutions, Microservices Architecture, Generative AI Models",8,0.51544905,1,0.5810602,"experience in DevOps, ML, MLOps, Big Data, Python, integration, and deployment methodologies. [...]","experienced, passionate pioneer in technology - a solutions builder, a roll-up-your-sleeves [...]","experience in data science, focus on generative model training, NLP and Azure ML and AI [...]","experiences, perspectives, and backgrounds. We provide advisory services, strategies, and [...]","experience with architecting and implementing solutions using Azure, including Azure Open AI. [...]",requirements and develop solutions that meet those needs.· Design and implement scalable and [...]
